{
  "total": 89,
  "offset": 83,
  "limit": 26,
  "activities": [
    {
      "id": 24,
      "name": "Example Name",
      "type": "ab",
      "state": "approved",
      "priority": 81,
      "modifiedAt": "2025-03-15T14:30:00Z",
      "startsAt": "2025-03-15T14:30:00Z",
      "endsAt": "2025-03-15T14:30:00Z"
    }
  ]
}